{"$id":"https://lowcountrydigitalworks.com/schemas/agent-trading-lab/run-manifest.v1.schema.json","$schema":"https://json-schema.org/draft/2020-12/schema","additionalProperties":false,"properties":{"allowed_redesign_count":{"minimum":0,"type":"integer"},"cost_config":{"type":"object"},"created_at_utc":{"format":"date-time","type":"string"},"derived_artifacts":{"items":{"additionalProperties":false,"properties":{"name":{"minLength":1,"type":"string"},"parent_hashes":{"items":{"pattern":"^[a-f0-9]{64}$","type":"string"},"type":"array"},"sha256":{"pattern":"^[a-f0-9]{64}$","type":"string"}},"required":["name","sha256","parent_hashes"],"type":"object"},"type":"array"},"deterministic_seeds":{"type":"object"},"environment_lock_hash":{"pattern":"^[a-f0-9]{64}$","type":"string"},"execution_config":{"type":"object"},"experiment_id":{"minLength":1,"type":"string"},"git_commit":{"minLength":1,"type":"string"},"integrations":{"additionalProperties":false,"properties":{"freqtrade_ref":{"type":["string","null"]},"prediction_market_bench_ref":{"type":["string","null"]}},"required":["freqtrade_ref","prediction_market_bench_ref"],"type":"object"},"model":{"additionalProperties":false,"properties":{"adapter_version":{"type":["string","null"]},"model_id":{"type":["string","null"]},"model_version":{"type":["string","null"]},"prompt_hash":{"pattern":"^[a-f0-9]{64}$","type":["string","null"]},"prompt_version":{"type":["string","null"]},"provider":{"type":["string","null"]},"schema_hash":{"pattern":"^[a-f0-9]{64}$","type":["string","null"]}},"required":["provider","model_id","model_version","prompt_version","prompt_hash","adapter_version","schema_hash"],"type":"object"},"partitions":{"items":{"additionalProperties":false,"properties":{"fraction":{"exclusiveMinimum":0,"maximum":1,"type":"number"},"locked":{"type":"boolean"},"name":{"minLength":1,"type":"string"}},"required":["name","fraction","locked"],"type":"object"},"minItems":1,"type":"array"},"run_id":{"minLength":1,"type":"string"},"schema_version":{"const":"run-manifest.v1"},"source":{"additionalProperties":false,"properties":{"counts":{"additionalProperties":false,"properties":{"events":{"minimum":0,"type":"integer"},"markets":{"minimum":0,"type":"integer"},"rows":{"minimum":0,"type":"integer"}},"required":["rows","events","markets"],"type":"object"},"coverage":{"additionalProperties":false,"properties":{"end_utc":{"format":"date-time","type":"string"},"start_utc":{"format":"date-time","type":"string"}},"required":["start_utc","end_utc"],"type":"object"},"license_ref":{"minLength":1,"type":"string"},"name":{"minLength":1,"type":"string"},"raw_inputs":{"items":{"additionalProperties":false,"properties":{"name":{"minLength":1,"type":"string"},"sha256":{"pattern":"^[a-f0-9]{64}$","type":"string"}},"required":["name","sha256"],"type":"object"},"minItems":1,"type":"array"},"retrieved_at_utc":{"format":"date-time","type":"string"},"timezone":{"minLength":1,"type":"string"},"upstream_url":{"minLength":1,"type":"string"},"version_ref":{"minLength":1,"type":"string"}},"required":["name","version_ref","upstream_url","retrieved_at_utc","license_ref","coverage","counts","timezone","raw_inputs"],"type":"object"},"track":{"enum":["0A","0B"]},"transform_code_commit":{"minLength":1,"type":"string"}},"required":["schema_version","run_id","experiment_id","track","created_at_utc","source","derived_artifacts","transform_code_commit","integrations","model","deterministic_seeds","git_commit","environment_lock_hash","execution_config","cost_config","partitions","allowed_redesign_count"],"title":"RunManifest v1","type":"object"}
